{
    "connector": {
        "name": "jsdom",
        "options": {
            "waitFor": 5000
        }
    },
    "formatters": [
        "html",
        "summary"
    ],
    "hints": {
        "apple-touch-icons": "error",
        "manifest-app-name": "error",
        "manifest-exists": "error",
        "manifest-file-extension": "error",
        "manifest-is-valid": "error"
    },
    "hintsTimeout": 120000,
    "parsers": [
        "manifest"
    ]
}
